{
  "formatVersion": 1,
  "id": "r4-golden",
  "name": "R4 Golden Deformation Avatar",
  "canvas": {"width":1,"height":1},
  "buffers": [{"id":"deform","uri":"buffers/deform.bin","byteLength":188}],
  "parameters": [
    {"id":"ParamAngleX","min":-30,"max":30,"default":0},
    {"id":"ParamAngleY","min":-30,"max":30,"default":0},
    {"id":"ParamAngleZ","min":-30,"max":30,"default":0},
    {"id":"ParamMouthOpenY","min":0,"max":1,"default":0}
  ],
  "parts": [{
    "id":"face","semantic":"face","drawOrder":0,"textureAtlas":null,
    "mesh": {
      "positions":{"buffer":"deform","byteOffset":0,"byteLength":32,"componentType":"f32","count":4,"stride":8},
      "uvs":{"buffer":"deform","byteOffset":32,"byteLength":32,"componentType":"f32","count":4,"stride":8},
      "indices":{"buffer":"deform","byteOffset":112,"byteLength":12,"componentType":"u16","count":6},
      "proxyZ":{"buffer":"deform","byteOffset":64,"byteLength":16,"componentType":"f32","count":4,"stride":4},
      "influenceRanges":{"buffer":"deform","byteOffset":80,"byteLength":32,"componentType":"u32","count":4,"stride":8}
    }
  }],
  "deformers": [{
    "id":"head","type":"pseudo3d_head","targets":["face"],
    "parameterBindings":[{"parameterId":"ParamAngleX"},{"parameterId":"ParamAngleY"},{"parameterId":"ParamAngleZ"}],
    "data":{"pivot":[0.5,0.5],"radius":[0.5,0.6],"depthScale":0.25,"perspective":0.35,"yawGain":1.0,"pitchGain":1.0}
  }],
  "deformationBuffers":{"morphInfluences":{"view":{"buffer":"deform","byteOffset":124,"byteLength":64,"count":4,"stride":16},"strideBytes":16}},
  "physics": []
}