{
  "formatVersion": 1,
  "id": "r8a-visual-golden",
  "name": "R8A Visual Golden Avatar",
  "canvas": { "width": 1, "height": 1 },
  "buffers": [{ "id": "geometry", "uri": "buffers/geometry.bin", "byteLength": 1180 }],
  "textures": [{ "id": "atlas0", "uri": "textures/atlas.png", "byteLength": 6232, "format": "png", "alphaMode": "straight", "filter": "linear" }],
  "parameters": [
    { "id": "ParamAngleX", "min": -30, "max": 30, "default": 0 },
    { "id": "ParamAngleY", "min": -30, "max": 30, "default": 0 },
    { "id": "ParamAngleZ", "min": -30, "max": 30, "default": 0 },
    { "id": "ParamHairX", "min": -1, "max": 1, "default": 0 }
  ],
  "parts": [
    { "id":"hair-back","semantic":"hair_back","drawOrder":0,"material":{"textureId":"atlas0","opacity":1,"blendMode":"normal"},"mesh":{"positions":{"buffer":"geometry","byteOffset":0,"byteLength":32,"componentType":"f32","count":4,"stride":8},"uvs":{"buffer":"geometry","byteOffset":32,"byteLength":32,"componentType":"f32","count":4,"stride":8},"indices":{"buffer":"geometry","byteOffset":112,"byteLength":12,"componentType":"u16","count":6},"proxyZ":{"buffer":"geometry","byteOffset":64,"byteLength":16,"componentType":"f32","count":4,"stride":4},"influenceRanges":{"buffer":"geometry","byteOffset":80,"byteLength":32,"componentType":"u32","count":4,"stride":8}}},
    { "id":"body","semantic":"body","drawOrder":1,"material":{"textureId":"atlas0","opacity":1,"blendMode":"normal"},"mesh":{"positions":{"buffer":"geometry","byteOffset":124,"byteLength":32,"componentType":"f32","count":4,"stride":8},"uvs":{"buffer":"geometry","byteOffset":156,"byteLength":32,"componentType":"f32","count":4,"stride":8},"indices":{"buffer":"geometry","byteOffset":236,"byteLength":12,"componentType":"u16","count":6},"proxyZ":{"buffer":"geometry","byteOffset":188,"byteLength":16,"componentType":"f32","count":4,"stride":4},"influenceRanges":{"buffer":"geometry","byteOffset":204,"byteLength":32,"componentType":"u32","count":4,"stride":8}}},
    { "id":"face","semantic":"face","drawOrder":2,"material":{"textureId":"atlas0","opacity":1,"blendMode":"normal"},"mesh":{"positions":{"buffer":"geometry","byteOffset":248,"byteLength":32,"componentType":"f32","count":4,"stride":8},"uvs":{"buffer":"geometry","byteOffset":280,"byteLength":32,"componentType":"f32","count":4,"stride":8},"indices":{"buffer":"geometry","byteOffset":360,"byteLength":12,"componentType":"u16","count":6},"proxyZ":{"buffer":"geometry","byteOffset":312,"byteLength":16,"componentType":"f32","count":4,"stride":4},"influenceRanges":{"buffer":"geometry","byteOffset":328,"byteLength":32,"componentType":"u32","count":4,"stride":8}}},
    { "id":"eye-white-l","semantic":"eye_l","drawOrder":3,"material":{"textureId":"atlas0","opacity":1,"blendMode":"normal"},"mesh":{"positions":{"buffer":"geometry","byteOffset":372,"byteLength":32,"componentType":"f32","count":4,"stride":8},"uvs":{"buffer":"geometry","byteOffset":404,"byteLength":32,"componentType":"f32","count":4,"stride":8},"indices":{"buffer":"geometry","byteOffset":484,"byteLength":12,"componentType":"u16","count":6},"proxyZ":{"buffer":"geometry","byteOffset":436,"byteLength":16,"componentType":"f32","count":4,"stride":4},"influenceRanges":{"buffer":"geometry","byteOffset":452,"byteLength":32,"componentType":"u32","count":4,"stride":8}}},
    { "id":"eye-white-r","semantic":"eye_r","drawOrder":3,"material":{"textureId":"atlas0","opacity":1,"blendMode":"normal"},"mesh":{"positions":{"buffer":"geometry","byteOffset":496,"byteLength":32,"componentType":"f32","count":4,"stride":8},"uvs":{"buffer":"geometry","byteOffset":528,"byteLength":32,"componentType":"f32","count":4,"stride":8},"indices":{"buffer":"geometry","byteOffset":608,"byteLength":12,"componentType":"u16","count":6},"proxyZ":{"buffer":"geometry","byteOffset":560,"byteLength":16,"componentType":"f32","count":4,"stride":4},"influenceRanges":{"buffer":"geometry","byteOffset":576,"byteLength":32,"componentType":"u32","count":4,"stride":8}}},
    { "id":"iris-l","semantic":"iris_l","drawOrder":4,"material":{"textureId":"atlas0","opacity":1,"blendMode":"normal"},"clip":{"sources":["eye-white-l"],"mode":"inside"},"mesh":{"positions":{"buffer":"geometry","byteOffset":620,"byteLength":32,"componentType":"f32","count":4,"stride":8},"uvs":{"buffer":"geometry","byteOffset":652,"byteLength":32,"componentType":"f32","count":4,"stride":8},"indices":{"buffer":"geometry","byteOffset":732,"byteLength":12,"componentType":"u16","count":6},"proxyZ":{"buffer":"geometry","byteOffset":684,"byteLength":16,"componentType":"f32","count":4,"stride":4},"influenceRanges":{"buffer":"geometry","byteOffset":700,"byteLength":32,"componentType":"u32","count":4,"stride":8}}},
    { "id":"iris-r","semantic":"iris_r","drawOrder":4,"material":{"textureId":"atlas0","opacity":1,"blendMode":"normal"},"clip":{"sources":["eye-white-r"],"mode":"inside"},"mesh":{"positions":{"buffer":"geometry","byteOffset":744,"byteLength":32,"componentType":"f32","count":4,"stride":8},"uvs":{"buffer":"geometry","byteOffset":776,"byteLength":32,"componentType":"f32","count":4,"stride":8},"indices":{"buffer":"geometry","byteOffset":856,"byteLength":12,"componentType":"u16","count":6},"proxyZ":{"buffer":"geometry","byteOffset":808,"byteLength":16,"componentType":"f32","count":4,"stride":4},"influenceRanges":{"buffer":"geometry","byteOffset":824,"byteLength":32,"componentType":"u32","count":4,"stride":8}}},
    { "id":"mouth","semantic":"mouth","drawOrder":5,"material":{"textureId":"atlas0","opacity":1,"blendMode":"normal"},"mesh":{"positions":{"buffer":"geometry","byteOffset":868,"byteLength":32,"componentType":"f32","count":4,"stride":8},"uvs":{"buffer":"geometry","byteOffset":900,"byteLength":32,"componentType":"f32","count":4,"stride":8},"indices":{"buffer":"geometry","byteOffset":980,"byteLength":12,"componentType":"u16","count":6},"proxyZ":{"buffer":"geometry","byteOffset":932,"byteLength":16,"componentType":"f32","count":4,"stride":4},"influenceRanges":{"buffer":"geometry","byteOffset":948,"byteLength":32,"componentType":"u32","count":4,"stride":8}}},
    { "id":"hair-front","semantic":"hair_front","drawOrder":6,"material":{"textureId":"atlas0","opacity":1,"blendMode":"normal"},"mesh":{"positions":{"buffer":"geometry","byteOffset":992,"byteLength":32,"componentType":"f32","count":4,"stride":8},"uvs":{"buffer":"geometry","byteOffset":1024,"byteLength":32,"componentType":"f32","count":4,"stride":8},"indices":{"buffer":"geometry","byteOffset":1104,"byteLength":12,"componentType":"u16","count":6},"proxyZ":{"buffer":"geometry","byteOffset":1056,"byteLength":16,"componentType":"f32","count":4,"stride":4},"influenceRanges":{"buffer":"geometry","byteOffset":1072,"byteLength":32,"componentType":"u32","count":4,"stride":8}}}
  ],
  "deformers": [{ "id":"head","type":"pseudo3d_head","targets":["hair-back","body","face","eye-white-l","eye-white-r","iris-l","iris-r","mouth","hair-front"],"parameterBindings":[{"parameterId":"ParamAngleX"},{"parameterId":"ParamAngleY"},{"parameterId":"ParamAngleZ"}],"data":{"pivot":[0.5,0.48],"radius":[0.35,0.42],"depthScale":0.22,"perspective":0.25,"yawGain":1,"pitchGain":1} }],
  "deformationBuffers": { "morphInfluences": { "view": { "buffer":"geometry","byteOffset":1116,"byteLength":64,"count":4,"stride":16 }, "strideBytes":16 } },
  "physics": [{ "id":"hair-front-sway","type":"spring_chain","nodeCount":5,"segmentLength":0.055,"root":[0.5,0.14],"gravity":[0,0.55],"damping":0.08,"stiffness":0.94,"maxDisplacement":0.8,"inputBindings":[{"parameterId":"ParamAngleX","axis":"x","gain":0.003}],"outputBindings":[{"parameterId":"ParamHairX","axis":"x","source":"tip","gain":2,"min":-1,"max":1}] }]
}